{
  "schemaVersion": 1,
  "registryVersion": "2026-08-17.1",
  "lastVerifiedAt": "2026-08-17T00:00:00Z",
  "reviewCadenceDays": 30,
  "criticalReviewAgeDays": 90,
  "minimum": {
    "eligibleEarnedRobux": 30000,
    "sourceIds": ["roblox-devex-program"],
    "lastVerifiedAt": "2026-08-17T00:00:00Z",
    "note": "Roblox states a minimum of 30,000 Earned Robux to submit a DevEx request. Meeting the number is not the same as being approved."
  },
  "rates": [
    {
      "id": "standard-current",
      "label": "Standard rate",
      "shortLabel": "Standard",
      "usdPerRobux": "0.0038",
      "usdPerThousandRobux": "3.80",
      "effectiveFrom": "2025-09-05T10:00:00-07:00",
      "effectiveTo": null,
      "status": "active",
      "eligibilitySummary": "The standard DevEx rate applied to eligible Earned Robux. Roblox documents this as 0.0038 USD per Earned Robux, which is 114 USD for 30,000 Earned Robux.",
      "conditionNote": null,
      "sourceIds": ["roblox-devex-program"],
      "lastVerifiedAt": "2026-08-17T00:00:00Z"
    },
    {
      "id": "us-18-plus-qualified",
      "label": "Eligible U.S. 18+ rate",
      "shortLabel": "U.S. 18+",
      "usdPerRobux": "0.0054",
      "usdPerThousandRobux": "5.40",
      "effectiveFrom": null,
      "effectiveTo": null,
      "status": "conditional",
      "eligibilitySummary": "A higher rate Roblox applies to certain Earned Robux from purchases of developer products, passes, subscriptions, and private servers made by United States players who have verified that they are at least 18 years old.",
      "conditionNote": "This rate is not selectable by the creator. Roblox determines which portion of a balance qualifies. Do not assume a whole balance earns this rate.",
      "sourceIds": ["roblox-devex-program"],
      "lastVerifiedAt": "2026-08-17T00:00:00Z"
    },
    {
      "id": "legacy-pre-2025-09-05",
      "label": "Legacy balance rate",
      "shortLabel": "Legacy",
      "usdPerRobux": "0.0035",
      "usdPerThousandRobux": "3.50",
      "effectiveFrom": null,
      "effectiveTo": "2025-09-05T10:00:00-07:00",
      "status": "legacy",
      "eligibilitySummary": "The rate that applied before 5 September 2025 at 10:00 PT, equal to 105 USD for 30,000 Earned Robux. Roblox cashes out balances earned before that moment at this older rate first.",
      "conditionNote": "Applies only to the portion of a balance earned before the transition, under Roblox's own accounting. A creator cannot choose this rate.",
      "sourceIds": ["roblox-devex-program"],
      "lastVerifiedAt": "2026-08-17T00:00:00Z"
    }
  ],
  "marketplace": {
    "lastVerifiedAt": "2026-08-17T00:00:00Z",
    "sourceIds": ["roblox-marketplace-fees", "roblox-monetization-overview"],
    "schemes": [
      {
        "id": "in-experience",
        "label": "In-experience purchase",
        "description": "Developer products, passes, private servers and subscriptions bought inside an experience you own.",
        "creatorSharePercent": "70",
        "platformSharePercent": "30",
        "progressive": false,
        "sourceIds": ["roblox-monetization-overview"]
      },
      {
        "id": "marketplace-avatar-item",
        "label": "Marketplace avatar item sale",
        "description": "An avatar item sold through the Roblox Marketplace. The creator share rises with the item's price as a multiple of the price floor.",
        "creatorSharePercent": "30",
        "platformSharePercent": "70",
        "progressive": true,
        "progressiveTiers": [
          { "priceFloorMultiple": "1", "creatorSharePercent": "30" },
          { "priceFloorMultiple": "1.3", "creatorSharePercent": "37" },
          { "priceFloorMultiple": "1.5", "creatorSharePercent": "41" },
          { "priceFloorMultiple": "2", "creatorSharePercent": "50" },
          { "priceFloorMultiple": "2.5", "creatorSharePercent": "57" },
          { "priceFloorMultiple": "3", "creatorSharePercent": "62" },
          { "priceFloorMultiple": "3.5", "creatorSharePercent": "65" },
          { "priceFloorMultiple": "4", "creatorSharePercent": "67" },
          { "priceFloorMultiple": "5", "creatorSharePercent": "69" },
          { "priceFloorMultiple": "6", "creatorSharePercent": "70" }
        ],
        "sourceIds": ["roblox-marketplace-fees"]
      },
      {
        "id": "avatar-item-in-experience",
        "label": "Avatar item sold inside an experience",
        "description": "An avatar item bought inside an experience. The item creator and the experience owner are paid separately.",
        "creatorSharePercent": "30",
        "platformSharePercent": "30",
        "experienceOwnerSharePercent": "40",
        "progressive": false,
        "sourceIds": ["roblox-marketplace-fees"]
      }
    ]
  },
  "limits": {
    "maxRobuxInput": 100000000000,
    "maxUsdTargetInput": 1000000000,
    "note": "These are application safety limits chosen by DevExCalculator.org to keep arithmetic and rendering bounded. They are not Roblox limits and must never be presented as such."
  }
}
